{"sa302":{"stage9TaxAfterReducers":"11938.25","giftAidTaxCharge":"0.00","c9_43":"11938.25","c12_1f":"11938.25","nicDue":"0.00","underpaidTaxCodedIn":"0.00","studentLoanDue":"0.00","payeAvailableToSa":"11000.00","incomePosition":"938.25","cgtDue":"4080.00","cgtOverpaid":"0.00","cgtRepayable":"0.00","combinedTotal":"5018.25"},"paymentsOnAccount":{"c13_10":"5018.25","c13_11":"938.25","c13_13":"0.00","c13_15":"0.00","eachPaymentOnAccount":"0.00","totalPayableOn31January":"5018.25"},"income":{"totalGrossIncome":"62500.00","engine":{"name":"FirstLot.TaxCalcEngine","version":"0.9.7+18228ccc9f5daa31c68642c4c253c69dd638cbb5"},"rateJurisdiction":"rUK","personalAllowance":"12570.00","taxableIncome":"49930.00","taperApplied":false,"bands":{"nonSavings":[{"bucket":"basic","taxable":"37700.00","rate":0.20,"tax":"7540.00"},{"bucket":"higher","taxable":"9730.00","rate":0.40,"tax":"3892.00"},{"bucket":"additional","taxable":"0.00","rate":0.45,"tax":"0.00"}],"savings":[{"bucket":"starter","taxable":"0.00","rate":0,"tax":"0.00"},{"bucket":"psa","taxable":"500.00","rate":0,"tax":"0.00"},{"bucket":"basic","taxable":"0.00","rate":0.20,"tax":"0.00"},{"bucket":"higher","taxable":"0.00","rate":0.40,"tax":"0.00"},{"bucket":"additional","taxable":"0.00","rate":0.45,"tax":"0.00"}],"dividends":[{"bucket":"allowance","taxable":"500.00","rate":0,"tax":"0.00"},{"bucket":"basic","taxable":"0.00","rate":0.0875,"tax":"0.00"},{"bucket":"higher","taxable":"1500.00","rate":0.3375,"tax":"506.25"},{"bucket":"additional","taxable":"0.00","rate":0.3935,"tax":"0.00"}]},"nonSavingsTax":"11432.00","savingsTax":"0.00","dividendTax":"506.25","totalIncomeTax":"11938.25","payeDeducted":"11000.00","foreignTaxCredit":"0.00","taxDeductedOnSavings":"0.00","lloydsUnderwritingTaxPaid":"0.00","partnershipTaxPaid":"0.00","otherIncomeTaxPaid":"0.00","propertyIncomeTaxPaid":"0.00","selfEmploymentTaxPaid":"0.00","foreignTaxDeducted":"0.00","marriageAllowanceRelief":"0.00","propertyFinanceCostsRelief":"0.00","childBenefitCharge":"0.00","winterFuelPaymentCharge":"0.00","statePensionLumpSumCharge":"0.00","ageRelatedMarriedCouplesAllowanceRelief":"0.00","giftAidBasicRateRelief":"0.00","netIncomeTaxDue":"938.25","residentModeTaxableIncome":"49930.00","foreignTaxCreditClaimed":"0.00","trustNotionalTaxCredit":"0.00","trustEstateNotionalTaxCredit":"0.00","trustSettlorNotionalTaxCredit":"0.00","giltInterestTaxPaid":"0.00","chargeableEventGainsTaxPaid":"0.00","lumpSumPaymentsTaxDeducted":"0.00","maintenancePaymentsRelief":"0.00","temporaryRepatriationFacilityCharge":"0.00","overseasWorkdayReliefAllowed":"0.00","annualAllowanceCharge":"0.00","unauthorisedPaymentsCharge":"0.00","overseasTransferCharge":"0.00","shortServiceRefundCharge":"0.00","pensionCharges":"0.00","deficiencyRelief":"0.00","deficiencyReliefClaimed":"0.00","topSlicingRelief":"0.00","chargeableEventGainsFullAmount":"0.00","chargeableEventGainsAppropriateFraction":"0.00","vctRelief":"0.00","eisRelief":"0.00","seisRelief":"0.00","citrRelief":"0.00","qualifyingDistributionRelief":"0.00","remittanceBasisCharge":"0.00","annuityAndRoyaltyTaxCharge":"0.00","dtaReliefCredit":"0.00","disregardedIncomeNotionalTax":"0.00","dividendNotionalTaxTreatedAsPaid":"0.00","lifePolicyNotionalTaxCredit":"0.00","trustUkTaxRelief":"0.00","legacyRemittedDividendCredit":"0.00"},"engineVersion":"0.9.7+18228ccc9f5daa31c68642c4c253c69dd638cbb5","sa302ArithmeticDigest":"sha256:3b01f1ff27bfb98e392a16279fe11e898e5b4a0a6d11f7288fbe984b791379bc","incomeArithmeticDigest":"sha256:37bce987f00e694a4ba568a8847f67d16da1dda489b5bbada34a6463e9122f6a","specials":[],"exclusions":[],"specialsEvaluated":false,"exclusionsEvaluated":false,"screening":{"taxYear":"2025-26","sources":[{"kind":"exclusions","document":"2025-26-Exclusions-Individuals-v1.0__1_.odt","docVersion":"v1.0","sha256":"c49cbfa4034119815beae43cc6905e5f66661e562c15dbeaa9f7c14506738573"},{"kind":"specials","document":"2025-2026-Specials-Individuals-v1.1.odt","docVersion":"v1.1","sha256":"210ea8efdfb12b7888c7708b43a12d8e1dfd0a373fa6f3b18bcc13087f5760ea"}],"screenedForms":["SA100","SA101","SA108","SA110"],"inputsOutsideScreenedForms":["formInputs.employmentGbp","formInputs.payeDeductedGbp"],"callerMustScreen":[{"kind":"exclusion","caseId":"18","title":"CAL14 entry without supporting entries fails validation","decidingBoxes":["CAL14","AOI14","LUN28","FSE71","FSE72","FPS11","SPS11"]},{"kind":"special","caseId":"13","title":"Other UK income taxable for more than one year (AOI15)","decidingBoxes":["AOI14","AOI15"]},{"kind":"special","caseId":"38","title":"BADR lifetime limit validation vs remitted gains from earlier years (CGT50/CGT50.1)","decidingBoxes":["CGT50","CGT50.1"]},{"kind":"special","caseId":"47","title":"RTT-reported CGT — overestimated gains/losses fail validation","decidingBoxes":["CGT13.7","CGT21","CGT29","CGT37"]},{"kind":"special","caseId":"18","title":"Multiple employer lump sums — £30,000 exemption per employer (ASE9)","decidingBoxes":["ASE9"]}],"notScreenedByDesign":[{"kind":"exclusion","caseId":"1","title":"Early submission of return before end of tax year","reason":"submissionTime"},{"kind":"exclusion","caseId":"3","title":"Records dealt with under separate arrangements — UTR not recognised","reason":"submissionTime"},{"kind":"exclusion","caseId":"6","title":"Online amendment window limited to 12 months from 31 January","reason":"submissionTime"},{"kind":"exclusion","caseId":"15","title":"Number of schedules exceeds schema limit","reason":"submissionTime"},{"kind":"exclusion","caseId":"100","title":"Taxpayer wishes to disclaim Personal Allowance","reason":"noSoftwareCriteria"},{"kind":"special","caseId":"1","title":"Documents to accompany the return — attachment size limit","reason":"submissionTime"},{"kind":"special","caseId":"4","title":"Repayment to nominee","reason":"submissionTime"},{"kind":"special","caseId":"5","title":"Limit restrictions on iterative boxes","reason":"submissionTime"},{"kind":"special","caseId":"7","title":"Foreign address — postal/zip code placement (FIN12/FIN13)","reason":"submissionTime"},{"kind":"special","caseId":"12","title":"'#' character not accepted in address fields","reason":"submissionTime"},{"kind":"special","caseId":"15","title":"Character limits on text boxes","reason":"submissionTime"},{"kind":"special","caseId":"17","title":"Total boxes should be present in XML","reason":"submissionTime"},{"kind":"special","caseId":"20","title":"Repayment due partly to employer and partly to employee","reason":"submissionTime"},{"kind":"special","caseId":"2","title":"Schema — SA100 mandatory element with no mandatory children (developer only)","reason":"submissionTime"}],"note":"Not fully screened: the request carries inputs from forms outside SA100/SA101/SA108/SA110 (inputsOutsideScreenedForms), whose registry rows this engine does not screen. The findings listed still apply."},"claimBoundary":{"governedRulesetLabelApplies":false,"cgtLegSupplied":true,"note":"Composed SA302 position. NOT the pinned tax-calc-engine/2025-26@0.9.7 stateless surface; serves current engine arithmetic. HMRC exclusions and specials are screened for SA100/SA101/SA108/SA110 inputs; see `screening`."}}